{
  "format": "igmg-lernapp-uebersetzung",
  "version": 1,
  "status": "entwurf",
  "richtung": "de-aus-ar",
  "einheit": "de.a2.e08",
  "eintraege": [
    {
      "bezug": "de.a2.e08.aehnlich",
      "text": "مشابه، متشابه",
      "quelle": "ki:lernapp-inhalte/a2/v1",
      "lizenz": "CC-BY-SA-4.0"
    },
    {
      "bezug": "de.a2.e08.genauso",
      "text": "تمامًا مثل، بالضبط (genauso schnell wie: سريع مثل … تمامًا)",
      "quelle": "ki:lernapp-inhalte/a2/v1",
      "lizenz": "CC-BY-SA-4.0"
    },
    {
      "bezug": "de.a2.e08.ebenso",
      "text": "كذلك، بالقدر نفسه (ebenso wichtig wie: مهمّ بقدر …)",
      "quelle": "ki:lernapp-inhalte/a2/v1",
      "lizenz": "CC-BY-SA-4.0"
    },
    {
      "bezug": "de.a2.e08.eher",
      "text": "بالأحرى، إلى حدٍّ ما",
      "quelle": "ki:lernapp-inhalte/a2/v1",
      "lizenz": "CC-BY-SA-4.0"
    },
    {
      "bezug": "de.a2.e08.je",
      "text": "لكلّ (fünf Euro je Stunde: خمسة يوروهات للساعة)",
      "quelle": "ki:lernapp-inhalte/a2/v1",
      "lizenz": "CC-BY-SA-4.0"
    },
    {
      "bezug": "de.a2.e08.per",
      "text": "عن طريق، بواسطة (per Post: بالبريد)",
      "quelle": "ki:lernapp-inhalte/a2/v1",
      "lizenz": "CC-BY-SA-4.0"
    },
    {
      "bezug": "de.a2.e08.zweimal",
      "text": "مرّتان",
      "quelle": "ki:lernapp-inhalte/a2/v1",
      "lizenz": "CC-BY-SA-4.0"
    },
    {
      "bezug": "de.a2.e08.anmelden",
      "text": "سجّل، يسجّل؛ sich anmelden: تسجّل، سجّل نفسه",
      "quelle": "ki:lernapp-inhalte/a2/v1",
      "lizenz": "CC-BY-SA-4.0"
    },
    {
      "bezug": "de.a2.e08.teilnehmen",
      "text": "شارك، يشارك (an: في)",
      "quelle": "ki:lernapp-inhalte/a2/v1",
      "lizenz": "CC-BY-SA-4.0"
    },
    {
      "bezug": "de.a2.e08.schwimmen",
      "text": "سبح، يسبح",
      "quelle": "ki:lernapp-inhalte/a2/v1",
      "lizenz": "CC-BY-SA-4.0"
    },
    {
      "bezug": "de.a2.e08.springen",
      "text": "قفز، يقفز",
      "quelle": "ki:lernapp-inhalte/a2/v1",
      "lizenz": "CC-BY-SA-4.0"
    },
    {
      "bezug": "de.a2.e08.werfen",
      "text": "رمى، يرمي",
      "quelle": "ki:lernapp-inhalte/a2/v1",
      "lizenz": "CC-BY-SA-4.0"
    },
    {
      "bezug": "de.a2.e08.rennen",
      "text": "عدا، يعدو؛ ركض بسرعة",
      "quelle": "ki:lernapp-inhalte/a2/v1",
      "lizenz": "CC-BY-SA-4.0"
    },
    {
      "bezug": "de.a2.e08.treten",
      "text": "ركل، يركل",
      "quelle": "ki:lernapp-inhalte/a2/v1",
      "lizenz": "CC-BY-SA-4.0"
    },
    {
      "bezug": "de.a2.e08.vergleichen",
      "text": "قارن، يقارن",
      "quelle": "ki:lernapp-inhalte/a2/v1",
      "lizenz": "CC-BY-SA-4.0"
    },
    {
      "bezug": "de.a2.e08.ueben",
      "text": "تمرّن، يتمرّن",
      "quelle": "ki:lernapp-inhalte/a2/v1",
      "lizenz": "CC-BY-SA-4.0"
    },
    {
      "bezug": "de.a2.e08.verein",
      "text": "نادٍ، جمعيّة",
      "quelle": "ki:lernapp-inhalte/a2/v1",
      "lizenz": "CC-BY-SA-4.0"
    },
    {
      "bezug": "de.a2.e08.mitglied",
      "text": "عضو",
      "quelle": "ki:lernapp-inhalte/a2/v1",
      "lizenz": "CC-BY-SA-4.0"
    },
    {
      "bezug": "de.a2.e08.beitrag",
      "text": "اشتراك، رسم العضويّة",
      "quelle": "ki:lernapp-inhalte/a2/v1",
      "lizenz": "CC-BY-SA-4.0"
    },
    {
      "bezug": "de.a2.e08.training",
      "text": "تدريب، تمرين",
      "quelle": "ki:lernapp-inhalte/a2/v1",
      "lizenz": "CC-BY-SA-4.0"
    },
    {
      "bezug": "de.a2.e08.trainer",
      "text": "مدرّب",
      "quelle": "ki:lernapp-inhalte/a2/v1",
      "lizenz": "CC-BY-SA-4.0"
    },
    {
      "bezug": "de.a2.e08.turnier",
      "text": "بطولة",
      "quelle": "ki:lernapp-inhalte/a2/v1",
      "lizenz": "CC-BY-SA-4.0"
    },
    {
      "bezug": "de.a2.e08.anmeldung",
      "text": "تسجيل",
      "quelle": "ki:lernapp-inhalte/a2/v1",
      "lizenz": "CC-BY-SA-4.0"
    },
    {
      "bezug": "de.a2.e08.tor",
      "text": "هدف؛ مرمى",
      "quelle": "ki:lernapp-inhalte/a2/v1",
      "lizenz": "CC-BY-SA-4.0"
    },
    {
      "bezug": "de.a2.e08.spieler",
      "text": "لاعب",
      "quelle": "ki:lernapp-inhalte/a2/v1",
      "lizenz": "CC-BY-SA-4.0"
    },
    {
      "bezug": "de.a2.e08.teilnehmer",
      "text": "مشارك",
      "quelle": "ki:lernapp-inhalte/a2/v1",
      "lizenz": "CC-BY-SA-4.0"
    },
    {
      "bezug": "de.a2.e08.schwimmbad",
      "text": "مسبح",
      "quelle": "ki:lernapp-inhalte/a2/v1",
      "lizenz": "CC-BY-SA-4.0"
    },
    {
      "bezug": "de.a2.e08.halle",
      "text": "صالة رياضيّة",
      "quelle": "ki:lernapp-inhalte/a2/v1",
      "lizenz": "CC-BY-SA-4.0"
    },
    {
      "bezug": "de.a2.e08.kurs",
      "text": "دورة",
      "quelle": "ki:lernapp-inhalte/a2/v1",
      "lizenz": "CC-BY-SA-4.0"
    },
    {
      "bezug": "de.a2.e08.erfahrung",
      "text": "خبرة، تجربة",
      "quelle": "ki:lernapp-inhalte/a2/v1",
      "lizenz": "CC-BY-SA-4.0"
    },
    {
      "bezug": "de.a2.e08.alter",
      "text": "سنّ، عمر",
      "quelle": "ki:lernapp-inhalte/a2/v1",
      "lizenz": "CC-BY-SA-4.0"
    },
    {
      "bezug": "de.a2.e08.art",
      "text": "نوع",
      "quelle": "ki:lernapp-inhalte/a2/v1",
      "lizenz": "CC-BY-SA-4.0"
    },
    {
      "bezug": "de.a2.e08.sportart",
      "text": "نوع من الرياضة",
      "quelle": "ki:lernapp-inhalte/a2/v1",
      "lizenz": "CC-BY-SA-4.0"
    },
    {
      "bezug": "de.a2.e08.basketball",
      "text": "كرة السلّة",
      "quelle": "ki:lernapp-inhalte/a2/v1",
      "lizenz": "CC-BY-SA-4.0"
    },
    {
      "bezug": "de.a2.e08.volleyball",
      "text": "الكرة الطائرة",
      "quelle": "ki:lernapp-inhalte/a2/v1",
      "lizenz": "CC-BY-SA-4.0"
    },
    {
      "bezug": "de.a2.e08.tennis",
      "text": "التنس",
      "quelle": "ki:lernapp-inhalte/a2/v1",
      "lizenz": "CC-BY-SA-4.0"
    },
    {
      "bezug": "de.a2.e08.tischtennis",
      "text": "تنس الطاولة",
      "quelle": "ki:lernapp-inhalte/a2/v1",
      "lizenz": "CC-BY-SA-4.0"
    },
    {
      "bezug": "de.a2.e08.handball",
      "text": "كرة اليد",
      "quelle": "ki:lernapp-inhalte/a2/v1",
      "lizenz": "CC-BY-SA-4.0"
    },
    {
      "bezug": "de.a2.e08.vergleich",
      "text": "مقارنة",
      "quelle": "ki:lernapp-inhalte/a2/v1",
      "lizenz": "CC-BY-SA-4.0"
    },
    {
      "bezug": "de.a2.e08.unterschied",
      "text": "فرق، اختلاف",
      "quelle": "ki:lernapp-inhalte/a2/v1",
      "lizenz": "CC-BY-SA-4.0"
    },
    {
      "bezug": "de.a2.e08.kraft",
      "text": "قوّة",
      "quelle": "ki:lernapp-inhalte/a2/v1",
      "lizenz": "CC-BY-SA-4.0"
    },
    {
      "bezug": "de.a2.e08.sieg",
      "text": "فوز، انتصار",
      "quelle": "ki:lernapp-inhalte/a2/v1",
      "lizenz": "CC-BY-SA-4.0"
    },
    {
      "bezug": "de.a2.e08.ergebnis",
      "text": "نتيجة",
      "quelle": "ki:lernapp-inhalte/a2/v1",
      "lizenz": "CC-BY-SA-4.0"
    },
    {
      "bezug": "de.a2.e08.gegner",
      "text": "خصم، منافس",
      "quelle": "ki:lernapp-inhalte/a2/v1",
      "lizenz": "CC-BY-SA-4.0"
    },
    {
      "bezug": "de.a2.e08.wettbewerb",
      "text": "مسابقة",
      "quelle": "ki:lernapp-inhalte/a2/v1",
      "lizenz": "CC-BY-SA-4.0"
    },
    {
      "bezug": "de.a2.e08.beginn",
      "text": "بداية، موعد البدء",
      "quelle": "ki:lernapp-inhalte/a2/v1",
      "lizenz": "CC-BY-SA-4.0"
    },
    {
      "bezug": "de.a2.e08.mal",
      "text": "مرّة (zum ersten Mal: لأوّل مرّة)",
      "quelle": "ki:lernapp-inhalte/a2/v1",
      "lizenz": "CC-BY-SA-4.0"
    },
    {
      "bezug": "de.a2.e08.fit",
      "text": "لائق بدنيًّا، نشيط",
      "quelle": "ki:lernapp-inhalte/a2/v1",
      "lizenz": "CC-BY-SA-4.0"
    },
    {
      "bezug": "de.a2.e08.sportlich",
      "text": "رياضيّ",
      "quelle": "ki:lernapp-inhalte/a2/v1",
      "lizenz": "CC-BY-SA-4.0"
    },
    {
      "bezug": "de.a2.e08.zwar",
      "text": "صحيح أنّ (zwar …, aber …: صحيح أنّ … لكنّ …)",
      "quelle": "ki:lernapp-inhalte/a2/v1",
      "lizenz": "CC-BY-SA-4.0"
    },
    {
      "bezug": "de.a2.e08.stadion",
      "text": "استاد، ملعب كبير",
      "quelle": "ki:lernapp-inhalte/a2/v1",
      "lizenz": "CC-BY-SA-4.0"
    },
    {
      "bezug": "de.a2.e08.schiedsrichter",
      "text": "حَكَم",
      "quelle": "ki:lernapp-inhalte/a2/v1",
      "lizenz": "CC-BY-SA-4.0"
    },
    {
      "bezug": "de.a2.e08.fan",
      "text": "مشجّع",
      "quelle": "ki:lernapp-inhalte/a2/v1",
      "lizenz": "CC-BY-SA-4.0"
    },
    {
      "bezug": "de.a2.e08.zuschauer",
      "text": "متفرّج",
      "quelle": "ki:lernapp-inhalte/a2/v1",
      "lizenz": "CC-BY-SA-4.0"
    },
    {
      "bezug": "de.a2.e08.niederlage",
      "text": "هزيمة، خسارة",
      "quelle": "ki:lernapp-inhalte/a2/v1",
      "lizenz": "CC-BY-SA-4.0"
    },
    {
      "bezug": "de.a2.e08.unentschieden",
      "text": "تعادل، متعادل",
      "quelle": "ki:lernapp-inhalte/a2/v1",
      "lizenz": "CC-BY-SA-4.0"
    },
    {
      "bezug": "de.a2.e08.saison",
      "text": "موسم",
      "quelle": "ki:lernapp-inhalte/a2/v1",
      "lizenz": "CC-BY-SA-4.0"
    },
    {
      "bezug": "de.a2.e08.meister",
      "text": "بطل",
      "quelle": "ki:lernapp-inhalte/a2/v1",
      "lizenz": "CC-BY-SA-4.0"
    },
    {
      "bezug": "de.a2.e08.klettern",
      "text": "تسلّق، يتسلّق",
      "quelle": "ki:lernapp-inhalte/a2/v1",
      "lizenz": "CC-BY-SA-4.0"
    },
    {
      "bezug": "de.a2.e08.kosten",
      "text": "تكاليف، مصاريف",
      "quelle": "ki:lernapp-inhalte/a2/v1",
      "lizenz": "CC-BY-SA-4.0"
    },
    {
      "bezug": "de.a2.e08.ausprobieren",
      "text": "جرّب، يجرّب",
      "quelle": "ki:lernapp-inhalte/a2/v1",
      "lizenz": "CC-BY-SA-4.0"
    },
    {
      "bezug": "de.a2.e08.anfaenger",
      "text": "مبتدئ",
      "quelle": "ki:lernapp-inhalte/a2/v1",
      "lizenz": "CC-BY-SA-4.0"
    },
    {
      "bezug": "de.a2.e08.duschen",
      "text": "استحمّ، يستحمّ (تحت الدشّ)",
      "quelle": "ki:lernapp-inhalte/a2/v1",
      "lizenz": "CC-BY-SA-4.0"
    },
    {